<?xml version="1.0" encoding="UTF-8"?>

<viaje  xmlns="viaje"
        xmlns:xsi="http://www.w3.org/2001/XMLSchema-instance"
        xsi:schemaLocation= "viaje viaje.xsd">
        
    <Informacion>
        <fecha_comienzo>2024-12-22</fecha_comienzo>
        <fecha_fin>2025-01-03</fecha_fin>   
    </Informacion>

    <Viajeros>
        <viajero>
            <nombre>Carlos Martínez Pérez</nombre>
            <edad>21</edad>
            <DNI>12345678A</DNI>
            <Pasaporte>123456789</Pasaporte>
            <Genero>Masculino</Genero>
        </viajero>

        <viajero>
            <nombre>Pepa Pig Ramírez</nombre>
            <edad>19</edad>
            <DNI>12345678B</DNI>
            <Pasaporte>223456789</Pasaporte>
            <Genero>Femenino</Genero>
        </viajero>
    </Viajeros>

    <Destinos>
        <destino>
            <Pais>
                <nombre>España</nombre>
                <Ciudades>
                    <ciudad>
                        <nombre>Madrid</nombre>
                        <fecha_llegada>2024-12-22</fecha_llegada>
                        <fecha_irse>2024-12-27</fecha_irse>
                    </ciudad>

                    <ciudad>
                        <nombre>Barcelona</nombre>
                        <fecha_llegada>2024-12-27</fecha_llegada>
                        <fecha_irse>2024-12-30</fecha_irse>
                    </ciudad>

                </Ciudades>
            </Pais>
        </destino>

        <destino>

            <Pais>
                <nombre>Italia</nombre>
                <Ciudades>
                    <ciudad>
                        <nombre>Roma</nombre>
                        <fecha_llegada>2024-12-30</fecha_llegada>
                        <fecha_irse>2025-01-03</fecha_irse>
                    </ciudad>
                </Ciudades>
            </Pais>
        </destino>
    </Destinos>

    <Vehiculos_viaje> 
        <vehiculo> 
            <tipo>Avión</tipo>
            <Marca>Hawker Beechcraft</Marca>
            <Modelo>400 XP</Modelo>
        </vehiculo>

        <vehiculo> 
            <tipo>Coche</tipo>
            <Marca>Porsche</Marca>
            <Modelo>Taycan Turbo S</Modelo>
        </vehiculo>
    </Vehiculos_viaje>

</viaje>